{
  "$schema": "http://json-schema.org/draft-07/schema#",
  "title": "Storyteller conformance suite",
  "description": "suite.json: the version of the suite and every vector file with its kind. The schema of a kind is schema/<kind>.schema.json.",
  "type": "object",
  "additionalProperties": false,
  "required": [ "name", "version", "description", "files" ],
  "properties": {
    "$schema": { "type": "string" },
    "name": { "type": "string", "minLength": 1 },
    "version": {
      "description": "The SemVer of the suite. Major: an expected result changes, a vector is removed or renamed, a field changes meaning, or a schema rejects a file it accepted. Minor: a vector, a file, a kind or an optional field is added. Patch: a description or the README changes.",
      "type": "string",
      "pattern": "^(0|[1-9][0-9]*)\\.(0|[1-9][0-9]*)\\.(0|[1-9][0-9]*)$"
    },
    "description": { "type": "string", "minLength": 1 },
    "files": {
      "type": "array",
      "minItems": 1,
      "uniqueItems": true,
      "items": {
        "type": "object",
        "additionalProperties": false,
        "required": [ "path", "kind" ],
        "properties": {
          "path": {
            "description": "Relative to the folder of suite.json, with '/' between folders.",
            "type": "string",
            "pattern": "^[a-z0-9-]+(/[a-z0-9-]+)*\\.json$"
          },
          "kind": { "type": "string", "enum": [ "flattening", "formats", "errors", "refresh" ] }
        }
      }
    }
  }
}
